{"$schema":"https://json-schema.org/draft/2020-12/schema","$id":"https://legal-content.codepackr.com/schemas/provision.schema.json","title":"Legal Provision","type":"object","required":["schemaVersion","entityType","id","version","status","title","jurisdiction","content","sources","updatedAt"],"properties":{"schemaVersion":{"type":"string"},"entityType":{"const":"provision"},"id":{"type":"string"},"version":{"type":"integer","minimum":1},"status":{"type":"string"},"title":{"type":"string"},"jurisdiction":{"type":"string"},"content":{"type":"object","properties":{"actId":{"type":"string"},"actName":{"type":"string"},"section":{"type":"string"},"article":{"type":"string"},"text":{"type":"string"},"heading":{"type":"string"},"commencement":{"type":"string"},"exceptions":{"type":"array","items":{"type":"string"}},"historicalNotes":{"type":"string"}},"additionalProperties":true},"sources":{"type":"array","items":{"type":"string"}},"updatedAt":{"type":"string","format":"date-time"},"effectiveFrom":{"type":["string","null"],"format":"date"},"effectiveTo":{"type":["string","null"],"format":"date"}},"additionalProperties":false}