{
  "schemaVersion": "v1",
  "entityType": "provision",
  "id": "provision:india:constitution-art-26",
  "version": 1,
  "status": "published",
  "title": "Article 26 — Freedom to manage religious affairs",
  "jurisdiction": "India",
  "content": {
    "actId": "constitution",
    "actName": "Constitution of India",
    "article": "26",
    "heading": "Freedom to manage religious affairs",
    "text": "Subject to public order, morality and health, every religious denomination or any section thereof shall have the right to establish and maintain institutions for religious and charitable purposes, manage its own affairs in matters of religion, own and acquire property, and administer such property in accordance with law.",
    "commencement": "1950-01-26"
  },
  "sources": ["source:india:india-code-constitution"],
  "updatedAt": "2026-09-30T21:00:00Z",
  "effectiveFrom": "1950-01-26",
  "effectiveTo": null
}
