{
  "schemaVersion": "v1",
  "entityType": "provision",
  "id": "provision:india:cpc-o6-r-17",
  "version": 1,
  "status": "published",
  "title": "Order VI Rule 17 — Amendment of pleadings — CPC 1908",
  "jurisdiction": "India",
  "content": {
    "actId": "cpc-1908",
    "actName": "Code of Civil Procedure, 1908",
    "order": "VI",
    "rule": "17",
    "heading": "Amendment of pleadings",
    "text": "The Court may at any stage of the proceedings allow either party to alter or amend his pleadings in such manner and on such terms as may be just, and all such amendments shall be made as may be necessary for the purpose of determining the real questions in controversy between the parties. Provided that no application for amendment shall be allowed after the trial has commenced, unless the Court comes to the conclusion that in spite of due diligence, the party could not have raised the matter before the commencement of trial."
  },
  "sources": ["source:india:india-code-cpc-1908"],
  "updatedAt": "2026-09-30T22:05:00Z",
  "effectiveFrom": "1909-01-01",
  "effectiveTo": null
}
