{
  "schemaVersion": "v1",
  "entityType": "provision",
  "id": "provision:india:fundamental-rights-equality",
  "version": 1,
  "status": "review",
  "title": "Articles 14–18 — Equality (subject provision)",
  "jurisdiction": "India",
  "content": {
    "actId": "constitution",
    "actName": "Constitution of India",
    "section": "arts-14-18",
    "article": "14-18",
    "heading": "Right to equality",
    "text": "Article 14: the State shall not deny to any person equality before the law or the equal protection of the laws within the territory of India. Articles 15 and 16 prohibit specified discrimination and contain enabling clauses for special provisions and reservations. Article 17 abolishes untouchability. Article 18 abolishes titles (military and academic distinctions excepted). Read official clause text under provision:india:constitution-art-14 through art-18."
  },
  "sources": ["source:india:india-code-constitution", "source:india:india-fundamental-rights-practice"],
  "updatedAt": "2026-10-01T07:45:00Z",
  "effectiveFrom": "1950-01-26",
  "effectiveTo": null
}
