{
  "schemaVersion": "v1",
  "entityType": "provision",
  "id": "provision:india:constitution-art-39",
  "version": 1,
  "status": "published",
  "title": "Article 39 — Certain principles of policy",
  "jurisdiction": "India",
  "content": {
    "actId": "constitution",
    "actName": "Constitution of India",
    "article": "39",
    "heading": "Certain principles of policy to be followed by the State",
    "text": "The State shall direct its policy towards securing adequate means of livelihood, distribution of material resources to subserve the common good, avoidance of concentration of wealth, equal pay for equal work, and protection of workers and children. Read the official clauses.",
    "commencement": "1950-01-26"
  },
  "sources": ["source:india:india-code-constitution"],
  "updatedAt": "2026-09-30T21:30:00Z",
  "effectiveFrom": "1950-01-26",
  "effectiveTo": null
}
