{
  "schemaVersion": "v1",
  "entityType": "provision",
  "id": "provision:india:constitution-art-131",
  "version": 1,
  "status": "published",
  "title": "Article 131 — Original jurisdiction of the Supreme Court",
  "jurisdiction": "India",
  "content": {
    "actId": "constitution",
    "actName": "Constitution of India",
    "article": "131",
    "heading": "Original jurisdiction of the Supreme Court",
    "text": "Subject to the provisions of this Constitution, the Supreme Court shall, to the exclusion of any other court, have original jurisdiction in any dispute between the Government of India and one or more States; or between the Government of India and any State or States on one side and one or more other States on the other; or between two or more States, if and in so far as the dispute involves any question (whether of law or fact) on which the existence or extent of a legal right depends. The proviso keeps certain treaty and similar disputes out as enacted."
  },
  "sources": ["source:india:india-code-constitution"],
  "updatedAt": "2026-09-30T22:15:00Z",
  "effectiveFrom": "1950-01-26",
  "effectiveTo": null
}
