{
  "schemaVersion": "v1",
  "entityType": "provision",
  "id": "provision:india:sra-s-14",
  "version": 1,
  "status": "published",
  "title": "Section 14 SRA — Contracts not specifically enforceable",
  "jurisdiction": "India",
  "content": {
    "actId": "sra-1963",
    "actName": "Specific Relief Act, 1963",
    "section": "14",
    "heading": "Contracts not specifically enforceable",
    "text": "The following contracts cannot be specifically enforced, namely: a contract where a party has obtained substituted performance under section 20; a contract which is so dependent on the personal qualifications of the parties that the court cannot enforce specific performance of its material terms; a contract which is in its nature determinable; a contract the performance of which involves the performance of a continuous duty which the court cannot supervise. Read the official list."
  },
  "sources": ["source:india:india-code-sra-1963"],
  "updatedAt": "2026-09-30T23:05:00Z",
  "effectiveFrom": "1964-03-01",
  "effectiveTo": null
}
