{
  "schemaVersion": "v1",
  "entityType": "provision",
  "id": "provision:india:bnss-s-415",
  "version": 1,
  "status": "published",
  "title": "Section 415 BNSS — Appeals from convictions",
  "jurisdiction": "India",
  "content": {
    "actId": "bnss-2023",
    "actName": "Bharatiya Nagarik Suraksha Sanhita, 2023",
    "section": "415",
    "heading": "Appeals from convictions",
    "text": "Any person convicted on a trial held by a High Court in its extraordinary original criminal jurisdiction may appeal to the Supreme Court. Any person convicted on a trial held by a Sessions Judge or an Additional Sessions Judge may appeal to the High Court. Any person convicted on a trial held by any other Court may appeal to the Court of Session, subject to the enacted exceptions. This is the successor of CrPC 374. Read the official text."
  },
  "sources": ["source:india:india-code-bnss-2023"],
  "updatedAt": "2026-09-30T22:55:00Z",
  "effectiveFrom": "2024-07-01",
  "effectiveTo": null
}
